results/all_scores_summary.csv

Model,Train_ACCURACY,Val_ACCURACY,Test_ACCURACY,Train_PRECISION,Val_PRECISION,Test_PRECISION,Train_RECALL,Val_RECALL,Test_RECALL,Train_F1,Val_F1,Test_F1,Train_ROC_AUC,Val_ROC_AUC,Test_ROC_AUC
CatBoost,0.9995,0.9991,0.9992,0.9202,0.8821,0.8963,1.0,0.9644,0.96,0.9585,0.9214,0.927,1.0,0.9987,0.9938
SMOTE,1.0,0.9995,0.9991,0.999,0.9316,0.8884,1.0,0.9689,0.9556,0.9995,0.9499,0.9208,1.0,0.9975,0.9932
XGBoost,0.9999,0.9993,0.9992,0.999,0.9579,0.9706,0.979,0.9111,0.88,0.9889,0.9339,0.9231,1.0,0.9969,0.994
Voting,1.0,0.9995,0.9993,1.0,0.9636,0.9712,1.0,0.9422,0.8978,1.0,0.9528,0.933,1.0,0.9965,0.9942
Stacking,1.0,0.9995,0.9994,1.0,0.9635,0.9853,1.0,0.9378,0.8933,1.0,0.9505,0.9371,1.0,0.9965,0.9941
LightGBM,1.0,0.9996,0.9993,1.0,0.9643,0.9581,1.0,0.96,0.9156,1.0,0.9621,0.9364,1.0,0.9964,0.991
Best_Tuned,1.0,0.9996,0.9994,1.0,0.9643,0.9674,1.0,0.96,0.9244,1.0,0.9621,0.9455,1.0,0.9964,0.9937
RandomForest,1.0,0.9992,0.999,1.0,0.9571,0.9741,1.0,0.8933,0.8356,1.0,0.9241,0.8995,1.0,0.9947,0.9926
LogisticRegression,0.9986,0.9985,0.9985,0.9355,0.8976,0.9405,0.7876,0.8178,0.7733,0.8552,0.8558,0.8488,0.9915,0.9936,0.9803
DecisionTree,1.0,0.9984,0.9985,1.0,0.8264,0.861,1.0,0.8889,0.8533,1.0,0.8565,0.8571,1.0,0.944,0.9263

README.md

## 12.1 Accuracy

For example, if 99.8% of transactions are legitimate, a model that predicts almost everything as legitimate could achieve very high accuracy while detecting very little fraud.

### Baseline Performance Insights:

* **Top Baseline F1-Score**: **LightGBM** achieved the highest baseline F1-score (**0.9364**) by delivering a superior balance of precision (95.81%) and recall (91.56%), identifying it as the best candidate for subsequent hyperparameter optimization.
* **Maximum Fraud Detection Sensitivity**: **CatBoost** achieved the highest recall (**96.00%**), detecting 216 out of 225 holdout frauds.
* **False Alarm Resistance**: **Random Forest** (97.41%) and **XGBoost** (97.06%) exhibited exceptional precision with minimal false positives.

# 20. Confusion Matrix

* **True Negative (TN = 42,482):** Legitimate transactions correctly classified as legitimate.
* **False Positive (FP = 6):** Legitimate transactions incorrectly flagged as fraud (0.014% false alarm rate).
* **False Negative (FN = 23):** Fraudulent transactions incorrectly missed as legitimate.
* **True Positive (TP = 202):** Fraudulent transactions correctly detected (89.78% sensitivity / recall).