reports/tables/final_results.csv

,accuracy,precision,recall,f1,roc_auc
LogisticRegression,0.998548451291176,0.9405405405405406,0.7733333333333333,0.848780487804878,0.9802594196531309
DecisionTree,0.9985016271392785,0.8609865470852018,0.8533333333333334,0.8571428571428571,0.9263018577794515
RandomForest,0.9990166928101515,0.9740932642487047,0.8355555555555556,0.8995215311004785,0.9925516747212285
XGBoost,0.9992274014936905,0.9705882352941176,0.88,0.9230769230769231,0.9940263394631688
LightGBM,0.9993444618734343,0.958139534883721,0.9155555555555556,0.9363636363636364,0.9909716730475534
CatBoost,0.9992039894177417,0.8962655601659751,0.96,0.927038626609442,0.9937856440511308
Best_Tuned,0.9994381101772294,0.9674418604651163,0.9244444444444444,0.9454545454545454,0.9937237180694156
Voting,0.9993210497974856,0.9711538461538461,0.8977777777777778,0.9330254041570438,0.9941913010732442
Stacking,0.9993678739493831,0.9852941176470589,0.8933333333333333,0.9370629370629371,0.9941268645787569
SMOTE,0.9991337531898954,0.8884297520661157,0.9555555555555556,0.9207708779443254,0.9932126195108684

README.md

### Baseline Performance Insights:

* **Top Baseline F1-Score**: **LightGBM** achieved the highest baseline F1-score (**0.9364**) by delivering a superior balance of precision (95.81%) and recall (91.56%), identifying it as the best candidate for subsequent hyperparameter optimization.
* **Maximum Fraud Detection Sensitivity**: **CatBoost** achieved the highest recall (**96.00%**), detecting 216 out of 225 holdout frauds.
* **False Alarm Resistance**: **Random Forest** (97.41%) and **XGBoost** (97.06%) exhibited exceptional precision with minimal false positives.

# 20. Confusion Matrix

* **True Negative (TN = 42,482):** Legitimate transactions correctly classified as legitimate.
* **False Positive (FP = 6):** Legitimate transactions incorrectly flagged as fraud (0.014% false alarm rate).
* **False Negative (FN = 23):** Fraudulent transactions incorrectly missed as legitimate.
* **True Positive (TP = 202):** Fraudulent transactions correctly detected (89.78% sensitivity / recall).